{
  "schema_version": 1,
  "generated_at": "2026-02-25T12:44:57+00:00",
  "generator": "tv_inventory.py",
  "workspace": "/Users/aribs/Documents/Organized/Codex Projects/skills/tradingview-desktop-control",
  "capabilities": [
    {
      "id": "chart.set_symbol",
      "label": "Set chart symbol",
      "surface": "desktop",
      "source": "tvctl",
      "risk_level": "low",
      "tags": [
        "chart",
        "search"
      ],
      "preconditions": [
        "chart visible"
      ],
      "action_recipe": {
        "runner": "tvctl.py",
        "subcommand": "set-symbol",
        "args_template": [
          "{{symbol}}"
        ],
        "timeouts": {
          "command_timeout_seconds": 45
        },
        "parameters": [
          {
            "name": "symbol",
            "required": true,
            "description": "Ticker/symbol to open"
          }
        ]
      }
    },
    {
      "id": "chart.add_indicator",
      "label": "Add indicator",
      "surface": "desktop",
      "source": "tvctl",
      "risk_level": "low",
      "tags": [
        "chart",
        "indicator"
      ],
      "preconditions": [
        "chart visible"
      ],
      "action_recipe": {
        "runner": "tvctl.py",
        "subcommand": "add-indicator",
        "args_template": [
          "{{query}}"
        ],
        "timeouts": {
          "command_timeout_seconds": 60
        },
        "parameters": [
          {
            "name": "query",
            "required": true,
            "description": "Indicator search query"
          }
        ]
      }
    },
    {
      "id": "watchlist.open_symbol",
      "label": "Open symbol via watchlist",
      "surface": "desktop",
      "source": "tvctl",
      "risk_level": "low",
      "tags": [
        "watchlist"
      ],
      "preconditions": [
        "watchlist calibrated"
      ]
    },
    {
      "id": "watchlist.add_symbol",
      "label": "Add symbol to watchlist",
      "surface": "desktop",
      "source": "tvctl",
      "risk_level": "low",
      "tags": [
        "watchlist"
      ],
      "preconditions": [
        "watchlist calibrated"
      ]
    },
    {
      "id": "watchlist.remove_row",
      "label": "Remove watchlist row",
      "surface": "desktop",
      "source": "tvctl",
      "risk_level": "medium",
      "tags": [
        "watchlist"
      ],
      "preconditions": [
        "watchlist calibrated"
      ]
    },
    {
      "id": "watchlist.reorder_rows",
      "label": "Reorder watchlist rows",
      "surface": "desktop",
      "source": "tvctl",
      "risk_level": "low",
      "tags": [
        "watchlist"
      ],
      "preconditions": [
        "watchlist calibrated"
      ]
    },
    {
      "id": "desktop.menu.tradingview-settings",
      "label": "TradingView > Settings\u2026",
      "surface": "desktop_menu",
      "source": "macos-ax-menu",
      "risk_level": "low",
      "enabled": true,
      "action_recipe": {
        "runner": "tvctl.py",
        "subcommand": "click-menu",
        "args": [
          "TradingView > Settings\u2026"
        ],
        "timeouts": {
          "command_timeout_seconds": 30
        }
      },
      "metadata": {
        "menu_path": [
          "TradingView",
          "Settings\u2026"
        ],
        "shortcut": {
          "cmd_char": ",",
          "cmd_modifiers_raw": "0",
          "cmd_glyph": null,
          "mark_char": null
        }
      }
    },
    {
      "id": "desktop.menu.tradingview-zoom-100-zoom",
      "label": "TradingView > Zoom 100% > Zoom +",
      "surface": "desktop_menu",
      "source": "macos-ax-menu",
      "risk_level": "low",
      "enabled": true,
      "action_recipe": {
        "runner": "tvctl.py",
        "subcommand": "click-menu",
        "args": [
          "TradingView > Zoom 100% > Zoom +"
        ],
        "timeouts": {
          "command_timeout_seconds": 30
        }
      },
      "metadata": {
        "menu_path": [
          "TradingView",
          "Zoom 100%",
          "Zoom +"
        ],
        "shortcut": {
          "cmd_char": "+",
          "cmd_modifiers_raw": "0",
          "cmd_glyph": null,
          "mark_char": null
        }
      }
    },
    {
      "id": "desktop.menu.tradingview-zoom-100-reset-to-100",
      "label": "TradingView > Zoom 100% > Reset to 100%",
      "surface": "desktop_menu",
      "source": "macos-ax-menu",
      "risk_level": "medium",
      "enabled": true,
      "action_recipe": {
        "runner": "tvctl.py",
        "subcommand": "click-menu",
        "args": [
          "TradingView > Zoom 100% > Reset to 100%"
        ],
        "timeouts": {
          "command_timeout_seconds": 30
        }
      },
      "metadata": {
        "menu_path": [
          "TradingView",
          "Zoom 100%",
          "Reset to 100%"
        ],
        "shortcut": {
          "cmd_char": "0",
          "cmd_modifiers_raw": "0",
          "cmd_glyph": null,
          "mark_char": null
        }
      }
    },
    {
      "id": "desktop.menu.tradingview-new-tab",
      "label": "TradingView > New tab",
      "surface": "desktop_menu",
      "source": "macos-ax-menu",
      "risk_level": "low",
      "enabled": true,
      "action_recipe": {
        "runner": "tvctl.py",
        "subcommand": "click-menu",
        "args": [
          "TradingView > New tab"
        ],
        "timeouts": {
          "command_timeout_seconds": 30
        }
      },
      "metadata": {
        "menu_path": [
          "TradingView",
          "New tab"
        ],
        "shortcut": {
          "cmd_char": "T",
          "cmd_modifiers_raw": "0",
          "cmd_glyph": null,
          "mark_char": null
        }
      }
    },
    {
      "id": "desktop.menu.tradingview-new-window",
      "label": "TradingView > New window",
      "surface": "desktop_menu",
      "source": "macos-ax-menu",
      "risk_level": "low",
      "enabled": true,
      "action_recipe": {
        "runner": "tvctl.py",
        "subcommand": "click-menu",
        "args": [
          "TradingView > New window"
        ],
        "timeouts": {
          "command_timeout_seconds": 30
        }
      },
      "metadata": {
        "menu_path": [
          "TradingView",
          "New window"
        ],
        "shortcut": {
          "cmd_char": "N",
          "cmd_modifiers_raw": "0",
          "cmd_glyph": null,
          "mark_char": null
        }
      }
    },
    {
      "id": "desktop.menu.tradingview-reopen-closed-tab",
      "label": "TradingView > Reopen closed tab",
      "surface": "desktop_menu",
      "source": "macos-ax-menu",
      "risk_level": "medium",
      "enabled": true,
      "action_recipe": {
        "runner": "tvctl.py",
        "subcommand": "click-menu",
        "args": [
          "TradingView > Reopen closed tab"
        ],
        "timeouts": {
          "command_timeout_seconds": 30
        }
      },
      "metadata": {
        "menu_path": [
          "TradingView",
          "Reopen closed tab"
        ],
        "shortcut": {
          "cmd_char": "T",
          "cmd_modifiers_raw": "1",
          "cmd_glyph": null,
          "mark_char": null
        }
      }
    },
    {
      "id": "desktop.menu.tradingview-open-link-from-clipboard",
      "label": "TradingView > Open link from clipboard",
      "surface": "desktop_menu",
      "source": "macos-ax-menu",
      "risk_level": "low",
      "enabled": true,
      "action_recipe": {
        "runner": "tvctl.py",
        "subcommand": "click-menu",
        "args": [
          "TradingView > Open link from clipboard"
        ],
        "timeouts": {
          "command_timeout_seconds": 30
        }
      },
      "metadata": {
        "menu_path": [
          "TradingView",
          "Open link from clipboard"
        ],
        "shortcut": {
          "cmd_char": null,
          "cmd_modifiers_raw": "0",
          "cmd_glyph": null,
          "mark_char": null
        }
      }
    },
    {
      "id": "desktop.menu.tradingview-color-theme-system",
      "label": "TradingView > Color theme > System",
      "surface": "desktop_menu",
      "source": "macos-ax-menu",
      "risk_level": "low",
      "enabled": true,
      "action_recipe": {
        "runner": "tvctl.py",
        "subcommand": "click-menu",
        "args": [
          "TradingView > Color theme > System"
        ],
        "timeouts": {
          "command_timeout_seconds": 30
        }
      },
      "metadata": {
        "menu_path": [
          "TradingView",
          "Color theme",
          "System"
        ],
        "shortcut": {
          "cmd_char": null,
          "cmd_modifiers_raw": "0",
          "cmd_glyph": null,
          "mark_char": null
        }
      }
    },
    {
      "id": "desktop.menu.tradingview-color-theme-dark",
      "label": "TradingView > Color theme > Dark",
      "surface": "desktop_menu",
      "source": "macos-ax-menu",
      "risk_level": "low",
      "enabled": true,
      "action_recipe": {
        "runner": "tvctl.py",
        "subcommand": "click-menu",
        "args": [
          "TradingView > Color theme > Dark"
        ],
        "timeouts": {
          "command_timeout_seconds": 30
        }
      },
      "metadata": {
        "menu_path": [
          "TradingView",
          "Color theme",
          "Dark"
        ],
        "shortcut": {
          "cmd_char": null,
          "cmd_modifiers_raw": "0",
          "cmd_glyph": null,
          "mark_char": "\u2713"
        }
      }
    },
    {
      "id": "desktop.menu.tradingview-color-theme-light",
      "label": "TradingView > Color theme > Light",
      "surface": "desktop_menu",
      "source": "macos-ax-menu",
      "risk_level": "low",
      "enabled": true,
      "action_recipe": {
        "runner": "tvctl.py",
        "subcommand": "click-menu",
        "args": [
          "TradingView > Color theme > Light"
        ],
        "timeouts": {
          "command_timeout_seconds": 30
        }
      },